{
  "schemaVersion": "1.0.0",
  "id": "into_the_deep_auto_cloud",
  "displayName": "INTO THE DEEP AUTO cloud (Ray)",
  "presets": {
    "fieldId": "into_the_deep_2024_field",
    "robotId": "mecanum_meepmeep_defaults",
    "scoringId": "into_the_deep_2024_scoring",
    "teammatePolicy": "none",
    "opponentPolicy": "static"
  },
  "algorithm": {
    "name": "rllib_ppo",
    "learningRate": 0.0003,
    "gamma": 0.99,
    "gaeLambda": 0.95,
    "clipRange": 0.2,
    "nSteps": 256,
    "batchSize": 4096,
    "nEpochs": 4,
    "entCoef": 0.01,
    "lstmHiddenSize": 256
  },
  "actionTier": "high_level_waypoint",
  "computeProfile": "cloud",
  "nEnvs": 1024,
  "episode": {
    "controlHz": 25,
    "durationS": 30,
    "physicsSubsteps": 2
  },
  "domainRandomization": {
    "poseJitterIn": 2.5,
    "headingJitterDeg": 5.0,
    "motorStrengthRange": [
      0.9,
      1.1
    ],
    "sensorNoiseScale": 1.0,
    "fieldBuildToleranceIn": 1.0,
    "curriculum": [
      {
        "untilFrac": 1.0,
        "unlock": [
          "full_noise"
        ]
      }
    ]
  },
  "budget": {
    "totalEnvSteps": 50000000,
    "wallClockLimitS": 28800,
    "earlyStopNoImproveSteps": 1000000
  },
  "evaluation": {
    "nTrials": 500,
    "confidence": 0.95,
    "heldOutSeedStart": 10000000,
    "pairCommonRandomNumbers": true
  },
  "objective": "mean_true_score",
  "export": {
    "onnx": false,
    "roadRunnerDialect": "rr1_actions"
  }
}
