{
  "schemaVersion": "1.0.0",
  "id": "biobuzz_auto_cloud",
  "displayName": "BIOBUZZ AUTO cloud",
  "presets": {
    "fieldId": "biobuzz_2026_field_v1",
    "robotId": "gobilda_mecanum_starter",
    "scoringId": "biobuzz_2026_scoring_v1",
    "teammatePolicy": "none",
    "opponentPolicy": "static"
  },
  "algorithm": {
    "name": "recurrent_ppo",
    "learningRate": 0.0003,
    "gamma": 0.99,
    "gaeLambda": 0.95,
    "clipRange": 0.2,
    "nSteps": 256,
    "batchSize": 4096,
    "nEpochs": 4,
    "entCoef": 0.01,
    "lstmHiddenSize": 256,
    "bcWarmupSteps": 0,
    "groupSize": 4
  },
  "actionTier": "high_level_waypoint",
  "computeProfile": "cloud",
  "nEnvs": 1024,
  "episode": {
    "controlHz": 25,
    "durationS": 30,
    "physicsSubsteps": 2
  },
  "domainRandomization": {
    "poseJitterIn": 2.5,
    "headingJitterDeg": 5.0,
    "motorStrengthRange": [
      0.9,
      1.1
    ],
    "sensorNoiseScale": 1.0,
    "fieldBuildToleranceIn": 1.0,
    "curriculum": []
  },
  "budget": {
    "totalEnvSteps": 50000000,
    "wallClockLimitS": 28800,
    "earlyStopNoImproveSteps": 1000000
  },
  "evaluation": {
    "nTrials": 500,
    "confidence": 0.95,
    "heldOutSeedStart": 10000000,
    "pairCommonRandomNumbers": true
  },
  "objective": "mean_true_score",
  "export": {
    "onnx": true,
    "roadRunnerDialect": "rr1_actions"
  }
}
